{
  "protocol": "https://headlessempire.com/network/protocol/0.1",
  "id": "https://old.example/headless-empire.json",
  "status": "moved",
  "updated_at": "2026-07-15T09:00:00Z",
  "moved_to": "https://new.example/headless-empire.json",
  "human": {"name": "Moved Example", "url": "https://old.example/"},
  "now": {"human_url": "https://old.example/now", "json_feed_url": "https://old.example/feed.json"},
  "collaboration": {"open": false, "contact_policy": "Follow the replacement manifest."}
}
